No.     Time           Source                Destination           Protocol Length Info
     53 3.247261       192.168.1.108         104.27.175.238        TCP      66     36561 → 80 [SYN] Seq=0 Win=65535 Len=0 MSS=1460 WS=256 SACK_PERM=1

Frame 53: 66 bytes on wire (528 bits), 66 bytes captured (528 bits) on interface \Device\NPF_{515AB600-9DD9-44FB-9043-185B381F60A2}, id 0
    Interface id: 0 (\Device\NPF_{515AB600-9DD9-44FB-9043-185B381F60A2})
        Interface name: \Device\NPF_{515AB600-9DD9-44FB-9043-185B381F60A2}
        Interface description: Беспроводная сеть
    Encapsulation type: Ethernet (1)
    Arrival Time: Apr 29, 2020 08:47:32.498319000 Финляндия (лето)
    [Time shift for this packet: 0.000000000 seconds]
    Epoch Time: 1588139252.498319000 seconds
    [Time delta from previous captured frame: 2.994611000 seconds]
    [Time delta from previous displayed frame: 0.000000000 seconds]
    [Time since reference or first frame: 3.247261000 seconds]
    Frame Number: 53
    Frame Length: 66 bytes (528 bits)
    Capture Length: 66 bytes (528 bits)
    [Frame is marked: True]
    [Frame is ignored: False]
    [Protocols in frame: eth:ethertype:ip:tcp]
    [Coloring Rule Name: HTTP]
    [Coloring Rule String: http || tcp.port == 80 || http2]
Ethernet II, Src: IntelCor_4f:90:fc (60:57:18:4f:90:fc), Dst: BelkinIn_c9:a4:30 (60:38:e0:c9:a4:30)
    Destination: BelkinIn_c9:a4:30 (60:38:e0:c9:a4:30)
        Address: BelkinIn_c9:a4:30 (60:38:e0:c9:a4:30)
        .... ..0. .... .... .... .... = LG bit: Globally unique address (factory default)
        .... ...0 .... .... .... .... = IG bit: Individual address (unicast)
    Source: IntelCor_4f:90:fc (60:57:18:4f:90:fc)
        Address: IntelCor_4f:90:fc (60:57:18:4f:90:fc)
        .... ..0. .... .... .... .... = LG bit: Globally unique address (factory default)
        .... ...0 .... .... .... .... = IG bit: Individual address (unicast)
    Type: IPv4 (0x0800)
Internet Protocol Version 4, Src: 192.168.1.108, Dst: 104.27.175.238
    0100 .... = Version: 4
    .... 0101 = Header Length: 20 bytes (5)
    Differentiated Services Field: 0x00 (DSCP: CS0, ECN: Not-ECT)
        0000 00.. = Differentiated Services Codepoint: Default (0)
        .... ..00 = Explicit Congestion Notification: Not ECN-Capable Transport (0)
    Total Length: 52
    Identification: 0x6171 (24945)
    Flags: 0x4000, Don't fragment
        0... .... .... .... = Reserved bit: Not set
        .1.. .... .... .... = Don't fragment: Set
        ..0. .... .... .... = More fragments: Not set
    Fragment offset: 0
    Time to live: 128
    Protocol: TCP (6)
    Header checksum: 0xbf34 [validation disabled]
    [Header checksum status: Unverified]
    Source: 192.168.1.108
    Destination: 104.27.175.238
Transmission Control Protocol, Src Port: 36561, Dst Port: 80, Seq: 0, Len: 0
    Source Port: 36561
    Destination Port: 80
    [Stream index: 0]
    [TCP Segment Len: 0]
    Sequence number: 0    (relative sequence number)
    Sequence number (raw): 2742283625
    [Next sequence number: 1    (relative sequence number)]
    Acknowledgment number: 0
    Acknowledgment number (raw): 0
    1000 .... = Header Length: 32 bytes (8)
    Flags: 0x002 (SYN)
        000. .... .... = Reserved: Not set
        ...0 .... .... = Nonce: Not set
        .... 0... .... = Congestion Window Reduced (CWR): Not set
        .... .0.. .... = ECN-Echo: Not set
        .... ..0. .... = Urgent: Not set
        .... ...0 .... = Acknowledgment: Not set
        .... .... 0... = Push: Not set
        .... .... .0.. = Reset: Not set
        .... .... ..1. = Syn: Set
            [Expert Info (Chat/Sequence): Connection establish request (SYN): server port 80]
                [Connection establish request (SYN): server port 80]
                [Severity level: Chat]
                [Group: Sequence]
        .... .... ...0 = Fin: Not set
        [TCP Flags: ··········S·]
    Window size value: 65535
    [Calculated window size: 65535]
    Checksum: 0x74f3 [unverified]
    [Checksum Status: Unverified]
    Urgent pointer: 0
    Options: (12 bytes), Maximum segment size, No-Operation (NOP), Window scale, No-Operation (NOP), No-Operation (NOP), SACK permitted
        TCP Option - Maximum segment size: 1460 bytes
            Kind: Maximum Segment Size (2)
            Length: 4
            MSS Value: 1460
        TCP Option - No-Operation (NOP)
            Kind: No-Operation (1)
        TCP Option - Window scale: 8 (multiply by 256)
            Kind: Window Scale (3)
            Length: 3
            Shift count: 8
            [Multiplier: 256]
        TCP Option - No-Operation (NOP)
            Kind: No-Operation (1)
        TCP Option - No-Operation (NOP)
            Kind: No-Operation (1)
        TCP Option - SACK permitted
            Kind: SACK Permitted (4)
            Length: 2
    [Timestamps]
        [Time since first frame in this TCP stream: 0.000000000 seconds]
        [Time since previous frame in this TCP stream: 0.000000000 seconds]

No.     Time           Source                Destination           Protocol Length Info
     54 3.247262       192.168.1.108         104.27.175.238        TCP      66     36562 → 80 [SYN] Seq=0 Win=65535 Len=0 MSS=1460 WS=256 SACK_PERM=1

Frame 54: 66 bytes on wire (528 bits), 66 bytes captured (528 bits) on interface \Device\NPF_{515AB600-9DD9-44FB-9043-185B381F60A2}, id 0
    Interface id: 0 (\Device\NPF_{515AB600-9DD9-44FB-9043-185B381F60A2})
        Interface name: \Device\NPF_{515AB600-9DD9-44FB-9043-185B381F60A2}
        Interface description: Беспроводная сеть
    Encapsulation type: Ethernet (1)
    Arrival Time: Apr 29, 2020 08:47:32.498320000 Финляндия (лето)
    [Time shift for this packet: 0.000000000 seconds]
    Epoch Time: 1588139252.498320000 seconds
    [Time delta from previous captured frame: 0.000001000 seconds]
    [Time delta from previous displayed frame: 0.000001000 seconds]
    [Time since reference or first frame: 3.247262000 seconds]
    Frame Number: 54
    Frame Length: 66 bytes (528 bits)
    Capture Length: 66 bytes (528 bits)
    [Frame is marked: True]
    [Frame is ignored: False]
    [Protocols in frame: eth:ethertype:ip:tcp]
    [Coloring Rule Name: HTTP]
    [Coloring Rule String: http || tcp.port == 80 || http2]
Ethernet II, Src: IntelCor_4f:90:fc (60:57:18:4f:90:fc), Dst: BelkinIn_c9:a4:30 (60:38:e0:c9:a4:30)
    Destination: BelkinIn_c9:a4:30 (60:38:e0:c9:a4:30)
        Address: BelkinIn_c9:a4:30 (60:38:e0:c9:a4:30)
        .... ..0. .... .... .... .... = LG bit: Globally unique address (factory default)
        .... ...0 .... .... .... .... = IG bit: Individual address (unicast)
    Source: IntelCor_4f:90:fc (60:57:18:4f:90:fc)
        Address: IntelCor_4f:90:fc (60:57:18:4f:90:fc)
        .... ..0. .... .... .... .... = LG bit: Globally unique address (factory default)
        .... ...0 .... .... .... .... = IG bit: Individual address (unicast)
    Type: IPv4 (0x0800)
Internet Protocol Version 4, Src: 192.168.1.108, Dst: 104.27.175.238
    0100 .... = Version: 4
    .... 0101 = Header Length: 20 bytes (5)
    Differentiated Services Field: 0x00 (DSCP: CS0, ECN: Not-ECT)
        0000 00.. = Differentiated Services Codepoint: Default (0)
        .... ..00 = Explicit Congestion Notification: Not ECN-Capable Transport (0)
    Total Length: 52
    Identification: 0x6170 (24944)
    Flags: 0x4000, Don't fragment
        0... .... .... .... = Reserved bit: Not set
        .1.. .... .... .... = Don't fragment: Set
        ..0. .... .... .... = More fragments: Not set
    Fragment offset: 0
    Time to live: 128
    Protocol: TCP (6)
    Header checksum: 0xbf35 [validation disabled]
    [Header checksum status: Unverified]
    Source: 192.168.1.108
    Destination: 104.27.175.238
Transmission Control Protocol, Src Port: 36562, Dst Port: 80, Seq: 0, Len: 0
    Source Port: 36562
    Destination Port: 80
    [Stream index: 1]
    [TCP Segment Len: 0]
    Sequence number: 0    (relative sequence number)
    Sequence number (raw): 2730360296
    [Next sequence number: 1    (relative sequence number)]
    Acknowledgment number: 0
    Acknowledgment number (raw): 0
    1000 .... = Header Length: 32 bytes (8)
    Flags: 0x002 (SYN)
        000. .... .... = Reserved: Not set
        ...0 .... .... = Nonce: Not set
        .... 0... .... = Congestion Window Reduced (CWR): Not set
        .... .0.. .... = ECN-Echo: Not set
        .... ..0. .... = Urgent: Not set
        .... ...0 .... = Acknowledgment: Not set
        .... .... 0... = Push: Not set
        .... .... .0.. = Reset: Not set
        .... .... ..1. = Syn: Set
            [Expert Info (Chat/Sequence): Connection establish request (SYN): server port 80]
                [Connection establish request (SYN): server port 80]
                [Severity level: Chat]
                [Group: Sequence]
        .... .... ...0 = Fin: Not set
        [TCP Flags: ··········S·]
    Window size value: 65535
    [Calculated window size: 65535]
    Checksum: 0x6529 [unverified]
    [Checksum Status: Unverified]
    Urgent pointer: 0
    Options: (12 bytes), Maximum segment size, No-Operation (NOP), Window scale, No-Operation (NOP), No-Operation (NOP), SACK permitted
        TCP Option - Maximum segment size: 1460 bytes
            Kind: Maximum Segment Size (2)
            Length: 4
            MSS Value: 1460
        TCP Option - No-Operation (NOP)
            Kind: No-Operation (1)
        TCP Option - Window scale: 8 (multiply by 256)
            Kind: Window Scale (3)
            Length: 3
            Shift count: 8
            [Multiplier: 256]
        TCP Option - No-Operation (NOP)
            Kind: No-Operation (1)
        TCP Option - No-Operation (NOP)
            Kind: No-Operation (1)
        TCP Option - SACK permitted
            Kind: SACK Permitted (4)
            Length: 2
    [Timestamps]
        [Time since first frame in this TCP stream: 0.000000000 seconds]
        [Time since previous frame in this TCP stream: 0.000000000 seconds]

No.     Time           Source                Destination           Protocol Length Info
     55 3.267200       104.27.175.238        192.168.1.108         TCP      66     80 → 36562 [SYN, ACK] Seq=0 Ack=1 Win=65535 Len=0 MSS=1400 SACK_PERM=1 WS=1024

Frame 55: 66 bytes on wire (528 bits), 66 bytes captured (528 bits) on interface \Device\NPF_{515AB600-9DD9-44FB-9043-185B381F60A2}, id 0
    Interface id: 0 (\Device\NPF_{515AB600-9DD9-44FB-9043-185B381F60A2})
        Interface name: \Device\NPF_{515AB600-9DD9-44FB-9043-185B381F60A2}
        Interface description: Беспроводная сеть
    Encapsulation type: Ethernet (1)
    Arrival Time: Apr 29, 2020 08:47:32.518258000 Финляндия (лето)
    [Time shift for this packet: 0.000000000 seconds]
    Epoch Time: 1588139252.518258000 seconds
    [Time delta from previous captured frame: 0.019938000 seconds]
    [Time delta from previous displayed frame: 0.019938000 seconds]
    [Time since reference or first frame: 3.267200000 seconds]
    Frame Number: 55
    Frame Length: 66 bytes (528 bits)
    Capture Length: 66 bytes (528 bits)
    [Frame is marked: True]
    [Frame is ignored: False]
    [Protocols in frame: eth:ethertype:ip:tcp]
    [Coloring Rule Name: HTTP]
    [Coloring Rule String: http || tcp.port == 80 || http2]
Ethernet II, Src: BelkinIn_c9:a4:30 (60:38:e0:c9:a4:30), Dst: IntelCor_4f:90:fc (60:57:18:4f:90:fc)
    Destination: IntelCor_4f:90:fc (60:57:18:4f:90:fc)
        Address: IntelCor_4f:90:fc (60:57:18:4f:90:fc)
        .... ..0. .... .... .... .... = LG bit: Globally unique address (factory default)
        .... ...0 .... .... .... .... = IG bit: Individual address (unicast)
    Source: BelkinIn_c9:a4:30 (60:38:e0:c9:a4:30)
        Address: BelkinIn_c9:a4:30 (60:38:e0:c9:a4:30)
        .... ..0. .... .... .... .... = LG bit: Globally unique address (factory default)
        .... ...0 .... .... .... .... = IG bit: Individual address (unicast)
    Type: IPv4 (0x0800)
Internet Protocol Version 4, Src: 104.27.175.238, Dst: 192.168.1.108
    0100 .... = Version: 4
    .... 0101 = Header Length: 20 bytes (5)
    Differentiated Services Field: 0x00 (DSCP: CS0, ECN: Not-ECT)
        0000 00.. = Differentiated Services Codepoint: Default (0)
        .... ..00 = Explicit Congestion Notification: Not ECN-Capable Transport (0)
    Total Length: 52
    Identification: 0x0000 (0)
    Flags: 0x4000, Don't fragment
        0... .... .... .... = Reserved bit: Not set
        .1.. .... .... .... = Don't fragment: Set
        ..0. .... .... .... = More fragments: Not set
    Fragment offset: 0
    Time to live: 59
    Protocol: TCP (6)
    Header checksum: 0x65a6 [validation disabled]
    [Header checksum status: Unverified]
    Source: 104.27.175.238
    Destination: 192.168.1.108
Transmission Control Protocol, Src Port: 80, Dst Port: 36562, Seq: 0, Ack: 1, Len: 0
    Source Port: 80
    Destination Port: 36562
    [Stream index: 1]
    [TCP Segment Len: 0]
    Sequence number: 0    (relative sequence number)
    Sequence number (raw): 2315358485
    [Next sequence number: 1    (relative sequence number)]
    Acknowledgment number: 1    (relative ack number)
    Acknowledgment number (raw): 2730360297
    1000 .... = Header Length: 32 bytes (8)
    Flags: 0x012 (SYN, ACK)
        000. .... .... = Reserved: Not set
        ...0 .... .... = Nonce: Not set
        .... 0... .... = Congestion Window Reduced (CWR): Not set
        .... .0.. .... = ECN-Echo: Not set
        .... ..0. .... = Urgent: Not set
        .... ...1 .... = Acknowledgment: Set
        .... .... 0... = Push: Not set
        .... .... .0.. = Reset: Not set
        .... .... ..1. = Syn: Set
            [Expert Info (Chat/Sequence): Connection establish acknowledge (SYN+ACK): server port 80]
                [Connection establish acknowledge (SYN+ACK): server port 80]
                [Severity level: Chat]
                [Group: Sequence]
        .... .... ...0 = Fin: Not set
        [TCP Flags: ·······A··S·]
    Window size value: 65535
    [Calculated window size: 65535]
    Checksum: 0x4a3b [unverified]
    [Checksum Status: Unverified]
    Urgent pointer: 0
    Options: (12 bytes), Maximum segment size, No-Operation (NOP), No-Operation (NOP), SACK permitted, No-Operation (NOP), Window scale
        TCP Option - Maximum segment size: 1400 bytes
            Kind: Maximum Segment Size (2)
            Length: 4
            MSS Value: 1400
        TCP Option - No-Operation (NOP)
            Kind: No-Operation (1)
        TCP Option - No-Operation (NOP)
            Kind: No-Operation (1)
        TCP Option - SACK permitted
            Kind: SACK Permitted (4)
            Length: 2
        TCP Option - No-Operation (NOP)
            Kind: No-Operation (1)
        TCP Option - Window scale: 10 (multiply by 1024)
            Kind: Window Scale (3)
            Length: 3
            Shift count: 10
            [Multiplier: 1024]
    [SEQ/ACK analysis]
        [This is an ACK to the segment in frame: 54]
        [The RTT to ACK the segment was: 0.019938000 seconds]
        [iRTT: 0.020081000 seconds]
    [Timestamps]
        [Time since first frame in this TCP stream: 0.019938000 seconds]
        [Time since previous frame in this TCP stream: 0.019938000 seconds]

No.     Time           Source                Destination           Protocol Length Info
     56 3.267201       104.27.175.238        192.168.1.108         TCP      66     80 → 36561 [SYN, ACK] Seq=0 Ack=1 Win=65535 Len=0 MSS=1400 SACK_PERM=1 WS=1024

Frame 56: 66 bytes on wire (528 bits), 66 bytes captured (528 bits) on interface \Device\NPF_{515AB600-9DD9-44FB-9043-185B381F60A2}, id 0
    Interface id: 0 (\Device\NPF_{515AB600-9DD9-44FB-9043-185B381F60A2})
        Interface name: \Device\NPF_{515AB600-9DD9-44FB-9043-185B381F60A2}
        Interface description: Беспроводная сеть
    Encapsulation type: Ethernet (1)
    Arrival Time: Apr 29, 2020 08:47:32.518259000 Финляндия (лето)
    [Time shift for this packet: 0.000000000 seconds]
    Epoch Time: 1588139252.518259000 seconds
    [Time delta from previous captured frame: 0.000001000 seconds]
    [Time delta from previous displayed frame: 0.000001000 seconds]
    [Time since reference or first frame: 3.267201000 seconds]
    Frame Number: 56
    Frame Length: 66 bytes (528 bits)
    Capture Length: 66 bytes (528 bits)
    [Frame is marked: True]
    [Frame is ignored: False]
    [Protocols in frame: eth:ethertype:ip:tcp]
    [Coloring Rule Name: HTTP]
    [Coloring Rule String: http || tcp.port == 80 || http2]
Ethernet II, Src: BelkinIn_c9:a4:30 (60:38:e0:c9:a4:30), Dst: IntelCor_4f:90:fc (60:57:18:4f:90:fc)
    Destination: IntelCor_4f:90:fc (60:57:18:4f:90:fc)
        Address: IntelCor_4f:90:fc (60:57:18:4f:90:fc)
        .... ..0. .... .... .... .... = LG bit: Globally unique address (factory default)
        .... ...0 .... .... .... .... = IG bit: Individual address (unicast)
    Source: BelkinIn_c9:a4:30 (60:38:e0:c9:a4:30)
        Address: BelkinIn_c9:a4:30 (60:38:e0:c9:a4:30)
        .... ..0. .... .... .... .... = LG bit: Globally unique address (factory default)
        .... ...0 .... .... .... .... = IG bit: Individual address (unicast)
    Type: IPv4 (0x0800)
Internet Protocol Version 4, Src: 104.27.175.238, Dst: 192.168.1.108
    0100 .... = Version: 4
    .... 0101 = Header Length: 20 bytes (5)
    Differentiated Services Field: 0x00 (DSCP: CS0, ECN: Not-ECT)
        0000 00.. = Differentiated Services Codepoint: Default (0)
        .... ..00 = Explicit Congestion Notification: Not ECN-Capable Transport (0)
    Total Length: 52
    Identification: 0x0000 (0)
    Flags: 0x4000, Don't fragment
        0... .... .... .... = Reserved bit: Not set
        .1.. .... .... .... = Don't fragment: Set
        ..0. .... .... .... = More fragments: Not set
    Fragment offset: 0
    Time to live: 59
    Protocol: TCP (6)
    Header checksum: 0x65a6 [validation disabled]
    [Header checksum status: Unverified]
    Source: 104.27.175.238
    Destination: 192.168.1.108
Transmission Control Protocol, Src Port: 80, Dst Port: 36561, Seq: 0, Ack: 1, Len: 0
    Source Port: 80
    Destination Port: 36561
    [Stream index: 0]
    [TCP Segment Len: 0]
    Sequence number: 0    (relative sequence number)
    Sequence number (raw): 595551740
    [Next sequence number: 1    (relative sequence number)]
    Acknowledgment number: 1    (relative ack number)
    Acknowledgment number (raw): 2742283626
    1000 .... = Header Length: 32 bytes (8)
    Flags: 0x012 (SYN, ACK)
        000. .... .... = Reserved: Not set
        ...0 .... .... = Nonce: Not set
        .... 0... .... = Congestion Window Reduced (CWR): Not set
        .... .0.. .... = ECN-Echo: Not set
        .... ..0. .... = Urgent: Not set
        .... ...1 .... = Acknowledgment: Set
        .... .... 0... = Push: Not set
        .... .... .0.. = Reset: Not set
        .... .... ..1. = Syn: Set
            [Expert Info (Chat/Sequence): Connection establish acknowledge (SYN+ACK): server port 80]
                [Connection establish acknowledge (SYN+ACK): server port 80]
                [Severity level: Chat]
                [Group: Sequence]
        .... .... ...0 = Fin: Not set
        [TCP Flags: ·······A··S·]
    Window size value: 65535
    [Calculated window size: 65535]
    Checksum: 0xeba0 [unverified]
    [Checksum Status: Unverified]
    Urgent pointer: 0
    Options: (12 bytes), Maximum segment size, No-Operation (NOP), No-Operation (NOP), SACK permitted, No-Operation (NOP), Window scale
        TCP Option - Maximum segment size: 1400 bytes
            Kind: Maximum Segment Size (2)
            Length: 4
            MSS Value: 1400
        TCP Option - No-Operation (NOP)
            Kind: No-Operation (1)
        TCP Option - No-Operation (NOP)
            Kind: No-Operation (1)
        TCP Option - SACK permitted
            Kind: SACK Permitted (4)
            Length: 2
        TCP Option - No-Operation (NOP)
            Kind: No-Operation (1)
        TCP Option - Window scale: 10 (multiply by 1024)
            Kind: Window Scale (3)
            Length: 3
            Shift count: 10
            [Multiplier: 1024]
    [SEQ/ACK analysis]
        [This is an ACK to the segment in frame: 53]
        [The RTT to ACK the segment was: 0.019940000 seconds]
        [iRTT: 0.020158000 seconds]
    [Timestamps]
        [Time since first frame in this TCP stream: 0.019940000 seconds]
        [Time since previous frame in this TCP stream: 0.019940000 seconds]

No.     Time           Source                Destination           Protocol Length Info
     57 3.267343       192.168.1.108         104.27.175.238        TCP      54     36562 → 80 [ACK] Seq=1 Ack=1 Win=262144 Len=0

Frame 57: 54 bytes on wire (432 bits), 54 bytes captured (432 bits) on interface \Device\NPF_{515AB600-9DD9-44FB-9043-185B381F60A2}, id 0
    Interface id: 0 (\Device\NPF_{515AB600-9DD9-44FB-9043-185B381F60A2})
        Interface name: \Device\NPF_{515AB600-9DD9-44FB-9043-185B381F60A2}
        Interface description: Беспроводная сеть
    Encapsulation type: Ethernet (1)
    Arrival Time: Apr 29, 2020 08:47:32.518401000 Финляндия (лето)
    [Time shift for this packet: 0.000000000 seconds]
    Epoch Time: 1588139252.518401000 seconds
    [Time delta from previous captured frame: 0.000142000 seconds]
    [Time delta from previous displayed frame: 0.000142000 seconds]
    [Time since reference or first frame: 3.267343000 seconds]
    Frame Number: 57
    Frame Length: 54 bytes (432 bits)
    Capture Length: 54 bytes (432 bits)
    [Frame is marked: True]
    [Frame is ignored: False]
    [Protocols in frame: eth:ethertype:ip:tcp]
    [Coloring Rule Name: HTTP]
    [Coloring Rule String: http || tcp.port == 80 || http2]
Ethernet II, Src: IntelCor_4f:90:fc (60:57:18:4f:90:fc), Dst: BelkinIn_c9:a4:30 (60:38:e0:c9:a4:30)
    Destination: BelkinIn_c9:a4:30 (60:38:e0:c9:a4:30)
        Address: BelkinIn_c9:a4:30 (60:38:e0:c9:a4:30)
        .... ..0. .... .... .... .... = LG bit: Globally unique address (factory default)
        .... ...0 .... .... .... .... = IG bit: Individual address (unicast)
    Source: IntelCor_4f:90:fc (60:57:18:4f:90:fc)
        Address: IntelCor_4f:90:fc (60:57:18:4f:90:fc)
        .... ..0. .... .... .... .... = LG bit: Globally unique address (factory default)
        .... ...0 .... .... .... .... = IG bit: Individual address (unicast)
    Type: IPv4 (0x0800)
Internet Protocol Version 4, Src: 192.168.1.108, Dst: 104.27.175.238
    0100 .... = Version: 4
    .... 0101 = Header Length: 20 bytes (5)
    Differentiated Services Field: 0x00 (DSCP: CS0, ECN: Not-ECT)
        0000 00.. = Differentiated Services Codepoint: Default (0)
        .... ..00 = Explicit Congestion Notification: Not ECN-Capable Transport (0)
    Total Length: 40
    Identification: 0x6172 (24946)
    Flags: 0x4000, Don't fragment
        0... .... .... .... = Reserved bit: Not set
        .1.. .... .... .... = Don't fragment: Set
        ..0. .... .... .... = More fragments: Not set
    Fragment offset: 0
    Time to live: 128
    Protocol: TCP (6)
    Header checksum: 0xbf3f [validation disabled]
    [Header checksum status: Unverified]
    Source: 192.168.1.108
    Destination: 104.27.175.238
Transmission Control Protocol, Src Port: 36562, Dst Port: 80, Seq: 1, Ack: 1, Len: 0
    Source Port: 36562
    Destination Port: 80
    [Stream index: 1]
    [TCP Segment Len: 0]
    Sequence number: 1    (relative sequence number)
    Sequence number (raw): 2730360297
    [Next sequence number: 1    (relative sequence number)]
    Acknowledgment number: 1    (relative ack number)
    Acknowledgment number (raw): 2315358486
    0101 .... = Header Length: 20 bytes (5)
    Flags: 0x010 (ACK)
        000. .... .... = Reserved: Not set
        ...0 .... .... = Nonce: Not set
        .... 0... .... = Congestion Window Reduced (CWR): Not set
        .... .0.. .... = ECN-Echo: Not set
        .... ..0. .... = Urgent: Not set
        .... ...1 .... = Acknowledgment: Set
        .... .... 0... = Push: Not set
        .... .... .0.. = Reset: Not set
        .... .... ..0. = Syn: Not set
        .... .... ...0 = Fin: Not set
        [TCP Flags: ·······A····]
    Window size value: 1024
    [Calculated window size: 262144]
    [Window size scaling factor: 256]
    Checksum: 0x86d4 [unverified]
    [Checksum Status: Unverified]
    Urgent pointer: 0
    [SEQ/ACK analysis]
        [This is an ACK to the segment in frame: 55]
        [The RTT to ACK the segment was: 0.000143000 seconds]
        [iRTT: 0.020081000 seconds]
    [Timestamps]
        [Time since first frame in this TCP stream: 0.020081000 seconds]
        [Time since previous frame in this TCP stream: 0.000143000 seconds]

No.     Time           Source                Destination           Protocol Length Info
     58 3.267419       192.168.1.108         104.27.175.238        TCP      54     36561 → 80 [ACK] Seq=1 Ack=1 Win=262144 Len=0

Frame 58: 54 bytes on wire (432 bits), 54 bytes captured (432 bits) on interface \Device\NPF_{515AB600-9DD9-44FB-9043-185B381F60A2}, id 0
    Interface id: 0 (\Device\NPF_{515AB600-9DD9-44FB-9043-185B381F60A2})
        Interface name: \Device\NPF_{515AB600-9DD9-44FB-9043-185B381F60A2}
        Interface description: Беспроводная сеть
    Encapsulation type: Ethernet (1)
    Arrival Time: Apr 29, 2020 08:47:32.518477000 Финляндия (лето)
    [Time shift for this packet: 0.000000000 seconds]
    Epoch Time: 1588139252.518477000 seconds
    [Time delta from previous captured frame: 0.000076000 seconds]
    [Time delta from previous displayed frame: 0.000076000 seconds]
    [Time since reference or first frame: 3.267419000 seconds]
    Frame Number: 58
    Frame Length: 54 bytes (432 bits)
    Capture Length: 54 bytes (432 bits)
    [Frame is marked: True]
    [Frame is ignored: False]
    [Protocols in frame: eth:ethertype:ip:tcp]
    [Coloring Rule Name: HTTP]
    [Coloring Rule String: http || tcp.port == 80 || http2]
Ethernet II, Src: IntelCor_4f:90:fc (60:57:18:4f:90:fc), Dst: BelkinIn_c9:a4:30 (60:38:e0:c9:a4:30)
    Destination: BelkinIn_c9:a4:30 (60:38:e0:c9:a4:30)
        Address: BelkinIn_c9:a4:30 (60:38:e0:c9:a4:30)
        .... ..0. .... .... .... .... = LG bit: Globally unique address (factory default)
        .... ...0 .... .... .... .... = IG bit: Individual address (unicast)
    Source: IntelCor_4f:90:fc (60:57:18:4f:90:fc)
        Address: IntelCor_4f:90:fc (60:57:18:4f:90:fc)
        .... ..0. .... .... .... .... = LG bit: Globally unique address (factory default)
        .... ...0 .... .... .... .... = IG bit: Individual address (unicast)
    Type: IPv4 (0x0800)
Internet Protocol Version 4, Src: 192.168.1.108, Dst: 104.27.175.238
    0100 .... = Version: 4
    .... 0101 = Header Length: 20 bytes (5)
    Differentiated Services Field: 0x00 (DSCP: CS0, ECN: Not-ECT)
        0000 00.. = Differentiated Services Codepoint: Default (0)
        .... ..00 = Explicit Congestion Notification: Not ECN-Capable Transport (0)
    Total Length: 40
    Identification: 0x6173 (24947)
    Flags: 0x4000, Don't fragment
        0... .... .... .... = Reserved bit: Not set
        .1.. .... .... .... = Don't fragment: Set
        ..0. .... .... .... = More fragments: Not set
    Fragment offset: 0
    Time to live: 128
    Protocol: TCP (6)
    Header checksum: 0xbf3e [validation disabled]
    [Header checksum status: Unverified]
    Source: 192.168.1.108
    Destination: 104.27.175.238
Transmission Control Protocol, Src Port: 36561, Dst Port: 80, Seq: 1, Ack: 1, Len: 0
    Source Port: 36561
    Destination Port: 80
    [Stream index: 0]
    [TCP Segment Len: 0]
    Sequence number: 1    (relative sequence number)
    Sequence number (raw): 2742283626
    [Next sequence number: 1    (relative sequence number)]
    Acknowledgment number: 1    (relative ack number)
    Acknowledgment number (raw): 595551741
    0101 .... = Header Length: 20 bytes (5)
    Flags: 0x010 (ACK)
        000. .... .... = Reserved: Not set
        ...0 .... .... = Nonce: Not set
        .... 0... .... = Congestion Window Reduced (CWR): Not set
        .... .0.. .... = ECN-Echo: Not set
        .... ..0. .... = Urgent: Not set
        .... ...1 .... = Acknowledgment: Set
        .... .... 0... = Push: Not set
        .... .... .0.. = Reset: Not set
        .... .... ..0. = Syn: Not set
        .... .... ...0 = Fin: Not set
        [TCP Flags: ·······A····]
    Window size value: 1024
    [Calculated window size: 262144]
    [Window size scaling factor: 256]
    Checksum: 0x283a [unverified]
    [Checksum Status: Unverified]
    Urgent pointer: 0
    [SEQ/ACK analysis]
        [This is an ACK to the segment in frame: 56]
        [The RTT to ACK the segment was: 0.000218000 seconds]
        [iRTT: 0.020158000 seconds]
    [Timestamps]
        [Time since first frame in this TCP stream: 0.020158000 seconds]
        [Time since previous frame in this TCP stream: 0.000218000 seconds]

No.     Time           Source                Destination           Protocol Length Info
     59 3.268314       192.168.1.108         104.27.175.238        HTTP     473    GET /icons/paomedia/small-n-flat/1024/gift-icon.png HTTP/1.1 

Frame 59: 473 bytes on wire (3784 bits), 473 bytes captured (3784 bits) on interface \Device\NPF_{515AB600-9DD9-44FB-9043-185B381F60A2}, id 0
    Interface id: 0 (\Device\NPF_{515AB600-9DD9-44FB-9043-185B381F60A2})
        Interface name: \Device\NPF_{515AB600-9DD9-44FB-9043-185B381F60A2}
        Interface description: Беспроводная сеть
    Encapsulation type: Ethernet (1)
    Arrival Time: Apr 29, 2020 08:47:32.519372000 Финляндия (лето)
    [Time shift for this packet: 0.000000000 seconds]
    Epoch Time: 1588139252.519372000 seconds
    [Time delta from previous captured frame: 0.000895000 seconds]
    [Time delta from previous displayed frame: 0.000895000 seconds]
    [Time since reference or first frame: 3.268314000 seconds]
    Frame Number: 59
    Frame Length: 473 bytes (3784 bits)
    Capture Length: 473 bytes (3784 bits)
    [Frame is marked: True]
    [Frame is ignored: False]
    [Protocols in frame: eth:ethertype:ip:tcp:http]
    [Coloring Rule Name: HTTP]
    [Coloring Rule String: http || tcp.port == 80 || http2]
Ethernet II, Src: IntelCor_4f:90:fc (60:57:18:4f:90:fc), Dst: BelkinIn_c9:a4:30 (60:38:e0:c9:a4:30)
    Destination: BelkinIn_c9:a4:30 (60:38:e0:c9:a4:30)
        Address: BelkinIn_c9:a4:30 (60:38:e0:c9:a4:30)
        .... ..0. .... .... .... .... = LG bit: Globally unique address (factory default)
        .... ...0 .... .... .... .... = IG bit: Individual address (unicast)
    Source: IntelCor_4f:90:fc (60:57:18:4f:90:fc)
        Address: IntelCor_4f:90:fc (60:57:18:4f:90:fc)
        .... ..0. .... .... .... .... = LG bit: Globally unique address (factory default)
        .... ...0 .... .... .... .... = IG bit: Individual address (unicast)
    Type: IPv4 (0x0800)
Internet Protocol Version 4, Src: 192.168.1.108, Dst: 104.27.175.238
    0100 .... = Version: 4
    .... 0101 = Header Length: 20 bytes (5)
    Differentiated Services Field: 0x00 (DSCP: CS0, ECN: Not-ECT)
        0000 00.. = Differentiated Services Codepoint: Default (0)
        .... ..00 = Explicit Congestion Notification: Not ECN-Capable Transport (0)
    Total Length: 459
    Identification: 0x6174 (24948)
    Flags: 0x4000, Don't fragment
        0... .... .... .... = Reserved bit: Not set
        .1.. .... .... .... = Don't fragment: Set
        ..0. .... .... .... = More fragments: Not set
    Fragment offset: 0
    Time to live: 128
    Protocol: TCP (6)
    Header checksum: 0xbd9a [validation disabled]
    [Header checksum status: Unverified]
    Source: 192.168.1.108
    Destination: 104.27.175.238
Transmission Control Protocol, Src Port: 36562, Dst Port: 80, Seq: 1, Ack: 1, Len: 419
    Source Port: 36562
    Destination Port: 80
    [Stream index: 1]
    [TCP Segment Len: 419]
    Sequence number: 1    (relative sequence number)
    Sequence number (raw): 2730360297
    [Next sequence number: 420    (relative sequence number)]
    Acknowledgment number: 1    (relative ack number)
    Acknowledgment number (raw): 2315358486
    0101 .... = Header Length: 20 bytes (5)
    Flags: 0x018 (PSH, ACK)
        000. .... .... = Reserved: Not set
        ...0 .... .... = Nonce: Not set
        .... 0... .... = Congestion Window Reduced (CWR): Not set
        .... .0.. .... = ECN-Echo: Not set
        .... ..0. .... = Urgent: Not set
        .... ...1 .... = Acknowledgment: Set
        .... .... 1... = Push: Set
        .... .... .0.. = Reset: Not set
        .... .... ..0. = Syn: Not set
        .... .... ...0 = Fin: Not set
        [TCP Flags: ·······AP···]
    Window size value: 1024
    [Calculated window size: 262144]
    [Window size scaling factor: 256]
    Checksum: 0xa723 [unverified]
    [Checksum Status: Unverified]
    Urgent pointer: 0
    [SEQ/ACK analysis]
        [iRTT: 0.020081000 seconds]
        [Bytes in flight: 419]
        [Bytes sent since last PSH flag: 419]
    [Timestamps]
        [Time since first frame in this TCP stream: 0.021052000 seconds]
        [Time since previous frame in this TCP stream: 0.000971000 seconds]
    TCP payload (419 bytes)
Hypertext Transfer Protocol
    GET /icons/paomedia/small-n-flat/1024/gift-icon.png HTTP/1.1\r\n
        [Expert Info (Chat/Sequence): GET /icons/paomedia/small-n-flat/1024/gift-icon.png HTTP/1.1\r\n]
            [GET /icons/paomedia/small-n-flat/1024/gift-icon.png HTTP/1.1\r\n]
            [Severity level: Chat]
            [Group: Sequence]
        Request Method: GET
        Request URI: /icons/paomedia/small-n-flat/1024/gift-icon.png
        Request Version: HTTP/1.1
    Accept: text/html,application/xhtml+xml,application/xml;q=0.9,*/*;q=0.8\r\n
    Accept-Language: ru-RU\r\n
    Upgrade-Insecure-Requests: 1\r\n
    User-Agent: Mozilla/5.0 (Windows NT 10.0; Win64; x64) AppleWebKit/537.36 (KHTML, like Gecko) Chrome/70.0.3538.102 Safari/537.36 Edge/18.18362\r\n
    Accept-Encoding: gzip, deflate\r\n
    Host: icons.iconarchive.com\r\n
    Connection: Keep-Alive\r\n
    \r\n
    [Full request URI: http://icons.iconarchive.com/icons/paomedia/small-n-flat/1024/gift-icon.png]
    [HTTP request 1/1]
    [Response in frame: 80]

No.     Time           Source                Destination           Protocol Length Info
     60 3.289441       104.27.175.238        192.168.1.108         TCP      54     80 → 36562 [ACK] Seq=1 Ack=420 Win=67584 Len=0

Frame 60: 54 bytes on wire (432 bits), 54 bytes captured (432 bits) on interface \Device\NPF_{515AB600-9DD9-44FB-9043-185B381F60A2}, id 0
    Interface id: 0 (\Device\NPF_{515AB600-9DD9-44FB-9043-185B381F60A2})
        Interface name: \Device\NPF_{515AB600-9DD9-44FB-9043-185B381F60A2}
        Interface description: Беспроводная сеть
    Encapsulation type: Ethernet (1)
    Arrival Time: Apr 29, 2020 08:47:32.540499000 Финляндия (лето)
    [Time shift for this packet: 0.000000000 seconds]
    Epoch Time: 1588139252.540499000 seconds
    [Time delta from previous captured frame: 0.021127000 seconds]
    [Time delta from previous displayed frame: 0.021127000 seconds]
    [Time since reference or first frame: 3.289441000 seconds]
    Frame Number: 60
    Frame Length: 54 bytes (432 bits)
    Capture Length: 54 bytes (432 bits)
    [Frame is marked: True]
    [Frame is ignored: False]
    [Protocols in frame: eth:ethertype:ip:tcp]
    [Coloring Rule Name: HTTP]
    [Coloring Rule String: http || tcp.port == 80 || http2]
Ethernet II, Src: BelkinIn_c9:a4:30 (60:38:e0:c9:a4:30), Dst: IntelCor_4f:90:fc (60:57:18:4f:90:fc)
    Destination: IntelCor_4f:90:fc (60:57:18:4f:90:fc)
        Address: IntelCor_4f:90:fc (60:57:18:4f:90:fc)
        .... ..0. .... .... .... .... = LG bit: Globally unique address (factory default)
        .... ...0 .... .... .... .... = IG bit: Individual address (unicast)
    Source: BelkinIn_c9:a4:30 (60:38:e0:c9:a4:30)
        Address: BelkinIn_c9:a4:30 (60:38:e0:c9:a4:30)
        .... ..0. .... .... .... .... = LG bit: Globally unique address (factory default)
        .... ...0 .... .... .... .... = IG bit: Individual address (unicast)
    Type: IPv4 (0x0800)
Internet Protocol Version 4, Src: 104.27.175.238, Dst: 192.168.1.108
    0100 .... = Version: 4
    .... 0101 = Header Length: 20 bytes (5)
    Differentiated Services Field: 0x00 (DSCP: CS0, ECN: Not-ECT)
        0000 00.. = Differentiated Services Codepoint: Default (0)
        .... ..00 = Explicit Congestion Notification: Not ECN-Capable Transport (0)
    Total Length: 40
    Identification: 0x3bcf (15311)
    Flags: 0x4000, Don't fragment
        0... .... .... .... = Reserved bit: Not set
        .1.. .... .... .... = Don't fragment: Set
        ..0. .... .... .... = More fragments: Not set
    Fragment offset: 0
    Time to live: 59
    Protocol: TCP (6)
    Header checksum: 0x29e3 [validation disabled]
    [Header checksum status: Unverified]
    Source: 104.27.175.238
    Destination: 192.168.1.108
Transmission Control Protocol, Src Port: 80, Dst Port: 36562, Seq: 1, Ack: 420, Len: 0
    Source Port: 80
    Destination Port: 36562
    [Stream index: 1]
    [TCP Segment Len: 0]
    Sequence number: 1    (relative sequence number)
    Sequence number (raw): 2315358486
    [Next sequence number: 1    (relative sequence number)]
    Acknowledgment number: 420    (relative ack number)
    Acknowledgment number (raw): 2730360716
    0101 .... = Header Length: 20 bytes (5)
    Flags: 0x010 (ACK)
        000. .... .... = Reserved: Not set
        ...0 .... .... = Nonce: Not set
        .... 0... .... = Congestion Window Reduced (CWR): Not set
        .... .0.. .... = ECN-Echo: Not set
        .... ..0. .... = Urgent: Not set
        .... ...1 .... = Acknowledgment: Set
        .... .... 0... = Push: Not set
        .... .... .0.. = Reset: Not set
        .... .... ..0. = Syn: Not set
        .... .... ...0 = Fin: Not set
        [TCP Flags: ·······A····]
    Window size value: 66
    [Calculated window size: 67584]
    [Window size scaling factor: 1024]
    Checksum: 0x88ef [unverified]
    [Checksum Status: Unverified]
    Urgent pointer: 0
    [SEQ/ACK analysis]
        [This is an ACK to the segment in frame: 59]
        [The RTT to ACK the segment was: 0.021127000 seconds]
        [iRTT: 0.020081000 seconds]
    [Timestamps]
        [Time since first frame in this TCP stream: 0.042179000 seconds]
        [Time since previous frame in this TCP stream: 0.021127000 seconds]

No.     Time           Source                Destination           Protocol Length Info
     61 3.298168       104.27.175.238        192.168.1.108         TCP      1514   80 → 36562 [ACK] Seq=1 Ack=420 Win=67584 Len=1460 [TCP segment of a reassembled PDU]

Frame 61: 1514 bytes on wire (12112 bits), 1514 bytes captured (12112 bits) on interface \Device\NPF_{515AB600-9DD9-44FB-9043-185B381F60A2}, id 0
    Interface id: 0 (\Device\NPF_{515AB600-9DD9-44FB-9043-185B381F60A2})
        Interface name: \Device\NPF_{515AB600-9DD9-44FB-9043-185B381F60A2}
        Interface description: Беспроводная сеть
    Encapsulation type: Ethernet (1)
    Arrival Time: Apr 29, 2020 08:47:32.549226000 Финляндия (лето)
    [Time shift for this packet: 0.000000000 seconds]
    Epoch Time: 1588139252.549226000 seconds
    [Time delta from previous captured frame: 0.008727000 seconds]
    [Time delta from previous displayed frame: 0.008727000 seconds]
    [Time since reference or first frame: 3.298168000 seconds]
    Frame Number: 61
    Frame Length: 1514 bytes (12112 bits)
    Capture Length: 1514 bytes (12112 bits)
    [Frame is marked: True]
    [Frame is ignored: False]
    [Protocols in frame: eth:ethertype:ip:tcp]
    [Coloring Rule Name: HTTP]
    [Coloring Rule String: http || tcp.port == 80 || http2]
Ethernet II, Src: BelkinIn_c9:a4:30 (60:38:e0:c9:a4:30), Dst: IntelCor_4f:90:fc (60:57:18:4f:90:fc)
